{
  "project": "<PROJECT_NAME>",
  "phase": "<PHASE_ID>",
  "requestedBy": "<REQUESTER>",
  "targetEnvironment": "staging",
  "targetUrl": "URL_PLACEHOLDER",
  "hostingProvider": "<vercel|netlify|other>",
  "branch": "<BRANCH>",
  "commit": "<COMMIT>",
  "filesChanged": ["<path/one>"],
  "scope": "<short scope statement>",
  "validatorsRequired": ["<validator>"],
  "validatorsRun": ["<validator>: PASS"],
  "requiredReviews": ["code-review", "security-review"],
  "reviewStatus": "<not-run|findings|passed>",
  "forbiddenActionsChecked": [
    "production deploy: NOT performed",
    "production DB mutation: NOT performed",
    "real sends/payment: NOT performed",
    "secrets used: NONE"
  ],
  "productionTouched": false,
  "databaseTouched": false,
  "databaseMutationPlanned": false,
  "externalSendsPlanned": false,
  "paymentActionPlanned": false,
  "secretsAccessed": false,
  "externalApisRequired": false,
  "rollbackPlan": "<how to revert the staging deploy>",
  "stagingProofPlan": "<what evidence will prove the staging deploy is safe>",
  "approvalStatus": "DRAFT",
  "ownerApprovalReference": "none",
  "decisionNeeded": "<exact owner/advisor decision>",
  "reportPath": "projectos/examples/generated/<name>.md"
}