{
  "project": "Demo SaaS Platform",
  "phase": "DEMO-DEPLOYGUARD-PHASE1A",
  "requestedBy": "demo-user",
  "targetEnvironment": "staging",
  "targetUrl": "URL_PLACEHOLDER",
  "hostingProvider": "vercel",
  "branch": "demo-branch",
  "commit": "(demo commit)",
  "filesChanged": ["src/demo/example.ts"],
  "scope": "Inert demo staging deploy request. No real project, no deploy.",
  "validatorsRequired": ["validate-all"],
  "validatorsRun": ["validate-all: ALL PASS"],
  "requiredReviews": ["code-review", "security-review"],
  "reviewStatus": "not-run",
  "forbiddenActionsChecked": [
    "production deploy: NOT performed",
    "production DB mutation: NOT performed",
    "real sends/payment: NOT performed",
    "secrets used: NONE"
  ],
  "productionTouched": false,
  "databaseTouched": false,
  "databaseMutationPlanned": false,
  "externalSendsPlanned": false,
  "paymentActionPlanned": false,
  "secretsAccessed": false,
  "externalApisRequired": false,
  "rollbackPlan": "Redeploy previous staging build; no DB change to revert.",
  "stagingProofPlan": "Smoke the staging URL read-only; confirm no console errors; confirm no real sends.",
  "approvalStatus": "DRAFT",
  "ownerApprovalReference": "none",
  "decisionNeeded": "Owner/advisor: approve a staging deploy plan? (inert demo — no decision required)",
  "reportPath": "projectos/examples/generated/demo-staging-deploy-plan.md"
}